21:50:25.981898 IP6 (hlim 64, next-header TCP (6) payload length: 40) ::1.47638 > ::1.80: Flags [S], cksum 0x0030 (incorrect -> 0xbc6b), seq 825439921, win 43690, options [mss 65476,sackOK,TS val 9946101 ecr 0,nop,wscale 7], length 0
21:50:25.981940 IP6 (hlim 64, next-header TCP (6) payload length: 20) ::1.80 > ::1.47638: Flags [R.], cksum 0x001c (incorrect -> 0x8d83), seq 0, ack 825439922, win 0, length 0
21:50:25.982306 IP (tos 0x0, ttl 64, id 33798, offset 0, flags [DF], proto TCP (6), length 60)
    127.0.0.1.35987 > 127.0.0.1.80: Flags [S], cksum 0xfe30 (incorrect -> 0xa084), seq 1799833587, win 43690, options [mss 65495,sackOK,TS val 9946101 ecr 0,nop,wscale 7], length 0
21:50:25.982358 IP (tos 0x0, ttl 64, id 0, offset 0, flags [DF], proto TCP (6), length 60)
    127.0.0.1.80 > 127.0.0.1.35987: Flags [S.], cksum 0xfe30 (incorrect -> 0x5d17), seq 425813358, ack 1799833588, win 43690, options [mss 65495,sackOK,TS val 9946101 ecr 9946101,nop,wscale 7], length 0
21:50:25.982404 IP (tos 0x0, ttl 64, id 33799, offset 0, flags [DF], proto TCP (6), length 52)
    127.0.0.1.35987 > 127.0.0.1.80: Flags [.], cksum 0xfe28 (incorrect -> 0x2f5c), seq 1, ack 1, win 342, options [nop,nop,TS val 9946101 ecr 9946101], length 0
21:50:25.982687 IP (tos 0x0, ttl 64, id 33800, offset 0, flags [DF], proto TCP (6), length 248)
    127.0.0.1.35987 > 127.0.0.1.80: Flags [P.], cksum 0xfeec (incorrect -> 0x130f), seq 1:197, ack 1, win 342, options [nop,nop,TS val 9946101 ecr 9946101], length 196
21:50:25.982778 IP (tos 0x0, ttl 64, id 42650, offset 0, flags [DF], proto TCP (6), length 52)
    127.0.0.1.80 > 127.0.0.1.35987: Flags [.], cksum 0xfe28 (incorrect -> 0x2e90), seq 1, ack 197, win 350, options [nop,nop,TS val 9946101 ecr 9946101], length 0
21:50:25.984910 IP (tos 0x0, ttl 64, id 42651, offset 0, flags [DF], proto TCP (6), length 65)
    127.0.0.1.80 > 127.0.0.1.35987: Flags [P.], cksum 0xfe35 (incorrect -> 0xc40a), seq 1:14, ack 197, win 350, options [nop,nop,TS val 9946102 ecr 9946101], length 13
21:50:25.985080 IP (tos 0x0, ttl 64, id 42652, offset 0, flags [DF], proto TCP (6), length 52)
    127.0.0.1.80 > 127.0.0.1.35987: Flags [R.], cksum 0xfe28 (incorrect -> 0x2e7e), seq 14, ack 197, win 350, options [nop,nop,TS val 9946102 ecr 9946101], length 0
21:50:25.985475 IP (tos 0x0, ttl 64, id 33801, offset 0, flags [DF], proto TCP (6), length 52)
    127.0.0.1.35987 > 127.0.0.1.80: Flags [.], cksum 0xfe28 (incorrect -> 0x2e89), seq 197, ack 14, win 342, options [nop,nop,TS val 9946102 ecr 9946102], length 0
21:50:25.985552 IP (tos 0x0, ttl 64, id 0, offset 0, flags [DF], proto TCP (6), length 40)
    127.0.0.1.80 > 127.0.0.1.35987: Flags [R], cksum 0xa61d (correct), seq 425813372, win 0, length 0

