21:50:09.291979 IP6 (hlim 64, next-header TCP (6) payload length: 40) ::1.47636 > ::1.80: Flags [S], cksum 0x0030 (incorrect -> 0xd833), seq 2734013623, win 43690, options [mss 65476,sackOK,TS val 9941094 ecr 0,nop,wscale 7], length 0
21:50:09.292018 IP6 (hlim 64, next-header TCP (6) payload length: 20) ::1.80 > ::1.47636: Flags [R.], cksum 0x001c (incorrect -> 0x95bc), seq 0, ack 2734013624, win 0, length 0
21:50:09.292296 IP (tos 0x0, ttl 64, id 32294, offset 0, flags [DF], proto TCP (6), length 60)
    127.0.0.1.35985 > 127.0.0.1.80: Flags [S], cksum 0xfe30 (incorrect -> 0x2814), seq 1895550528, win 43690, options [mss 65495,sackOK,TS val 9941094 ecr 0,nop,wscale 7], length 0
21:50:09.292347 IP (tos 0x0, ttl 64, id 0, offset 0, flags [DF], proto TCP (6), length 60)
    127.0.0.1.80 > 127.0.0.1.35985: Flags [S.], cksum 0xfe30 (incorrect -> 0x0e38), seq 3158682759, ack 1895550529, win 43690, options [mss 65495,sackOK,TS val 9941094 ecr 9941094,nop,wscale 7], length 0
21:50:09.292392 IP (tos 0x0, ttl 64, id 32295, offset 0, flags [DF], proto TCP (6), length 52)
    127.0.0.1.35985 > 127.0.0.1.80: Flags [.], cksum 0xfe28 (incorrect -> 0xe07c), seq 1, ack 1, win 342, options [nop,nop,TS val 9941094 ecr 9941094], length 0
21:50:09.292617 IP (tos 0x0, ttl 64, id 32296, offset 0, flags [DF], proto TCP (6), length 249)
    127.0.0.1.35985 > 127.0.0.1.80: Flags [P.], cksum 0xfeed (incorrect -> 0xb256), seq 1:198, ack 1, win 342, options [nop,nop,TS val 9941094 ecr 9941094], length 197
21:50:09.292655 IP (tos 0x0, ttl 64, id 7406, offset 0, flags [DF], proto TCP (6), length 52)
    127.0.0.1.80 > 127.0.0.1.35985: Flags [.], cksum 0xfe28 (incorrect -> 0xdfaf), seq 1, ack 198, win 350, options [nop,nop,TS val 9941094 ecr 9941094], length 0
21:50:09.295937 IP (tos 0x0, ttl 64, id 7407, offset 0, flags [DF], proto TCP (6), length 116)
    127.0.0.1.80 > 127.0.0.1.35985: Flags [P.], cksum 0xfe68 (incorrect -> 0xce26), seq 1:65, ack 198, win 350, options [nop,nop,TS val 9941095 ecr 9941094], length 64
21:50:09.296214 IP (tos 0x0, ttl 64, id 7408, offset 0, flags [DF], proto TCP (6), length 321)
    127.0.0.1.80 > 127.0.0.1.35985: Flags [FP.], cksum 0xff35 (incorrect -> 0x1d92), seq 65:334, ack 198, win 350, options [nop,nop,TS val 9941095 ecr 9941094], length 269
21:50:09.296852 IP (tos 0x0, ttl 64, id 32297, offset 0, flags [DF], proto TCP (6), length 52)
    127.0.0.1.35985 > 127.0.0.1.80: Flags [.], cksum 0xfe28 (incorrect -> 0xdf75), seq 198, ack 65, win 342, options [nop,nop,TS val 9941095 ecr 9941095], length 0
21:50:09.297588 IP (tos 0x0, ttl 64, id 32298, offset 0, flags [DF], proto TCP (6), length 52)
    127.0.0.1.35985 > 127.0.0.1.80: Flags [R.], cksum 0xfe28 (incorrect -> 0xde5b), seq 198, ack 335, win 350, options [nop,nop,TS val 9941095 ecr 9941095], length 0

